{
  "$schema": "https://json-schema.org/draft/2020-12/schema",
  "$id": "https://github.com/chris-dare-dev/math-formal-contract-lean/schema/run-1.0.schema.json",
  "title": "run/1.0 - the provenance of one CI run, deliberately NOT committed",
  "$comment": "Every field CI regenerates on every commit lives here and nowhere else. The artifacts this record names are committed and must be byte-identical across two runs of an unchanged environment, which is what `git diff --exit-code attest/` asserts; a `produced_at` inside one of them makes that gate red on every no-op commit, and a gate that is red on no-op commits is deleted within the week. This file is written to attest/run.json, gitignored, and attached as a release asset -- so the provenance is kept, in the one place where keeping it costs nothing.",
  "type": "object",
  "additionalProperties": false,
  "required": [
    "schema_version",
    "produced_at",
    "produced_by",
    "ci",
    "files"
  ],
  "properties": {
    "schema_version": {
      "const": "run/1.0"
    },
    "produced_at": {
      "type": "string",
      "$comment": "The single timestamp of the run. It is here, once, rather than repeated inside every artifact it produced."
    },
    "produced_by": {
      "type": "string",
      "pattern": "^mfc/[0-9]+\\.[0-9]+\\.[0-9]+$"
    },
    "ci": {
      "type": "object",
      "additionalProperties": false,
      "required": [
        "run_url",
        "workflow_sha",
        "runner"
      ],
      "$comment": "Null on a local run, and null is the honest value there -- a workstation has no run URL. It is NOT reported as an empty string, which would read as a URL nobody filled in.",
      "properties": {
        "run_url": {
          "type": [
            "string",
            "null"
          ]
        },
        "workflow_sha": {
          "type": [
            "string",
            "null"
          ],
          "pattern": "^([0-9a-f]{40})?$"
        },
        "runner": {
          "type": [
            "string",
            "null"
          ]
        }
      }
    },
    "files": {
      "type": "array",
      "minItems": 1,
      "$comment": "What this run produced, by digest. This is the join back to the committed tree: a release asset naming attest/bundle.json by sha256 can be checked against the bundle.json in the tag without trusting anything in this file.",
      "items": {
        "type": "object",
        "additionalProperties": false,
        "required": [
          "file",
          "sha256"
        ],
        "properties": {
          "file": {
            "type": "string"
          },
          "sha256": {
            "type": "string",
            "pattern": "^[0-9a-f]{64}$"
          }
        }
      }
    }
  }
}
